"qty (number)","title","body","level","school","classes","casting time","range","components","duration"
"1","Commune","You contact your deity or a divine proxy and ask up to three questions that can be answered with a yes or no. You must ask your questions before the spell ends. You receive a correct answer for each question.

Divine beings aren't necessarily omniscient, so you might receive ""unclear"" as an answer if a question pertains to information that lies beyond the deity's knowledge. In a case where a one-word answer could be misleading or contrary to the deity's interests, the GM might offer a short phrase as an answer instead.

If you cast the spell two or more times before finishing your next long rest, there is a cumulative 25 percent chance for each casting after the first that you get no answer. The GM makes this roll in secret.","5","Divination","Cleric","1 minute","Self","V, S, M (incense and a vial of holy or unholy water)","1 minute"
"1","Commune with Nature","You briefly become one with nature and gain knowledge of the surrounding territory. In the outdoors, the spell gives you knowledge of the land within 3 miles of you. In caves and other natural underground settings, the radius is limited to 300 feet. The spell doesn't function where nature has been replaced by construction, such as in dungeons and towns.

You instantly gain knowledge of up to three facts of your choice about any of the following subjects as they relate to the area:

terrain and bodies of water
prevalent plants, minerals, animals, or peoples
powerful celestials, fey, fiends, elementals, or undead
influence from other planes of existence
buildings
For example, you could determine the location of powerful undead in the area, the location of major sources of safe drinking water, and the location of any nearby towns.","5","Divination (ritual)","Druid, Ranger","1 minute","Self","V, S","Instantaneous"
"1","Comprehend Languages","For the duration, you understand the literal meaning of any spoken language that you hear. You also understand any written language that you see, but you must be touching the surface on which the words are written. It takes about 1 minute to read one page of text.

This spell doesn't decode secret messages in a text or a glyph, such as an arcane sigil, that isn't part of a written language.","1","Divination (ritual)","Bard, Sorcerer, Warlock, Wizard","1 action","Self","V, S, M (a pinch of soot and salt)","1 hour"
"1","Compulsion","Creatures of your choice that you can see within range and that can hear you must make a Wisdom saving throw. A target automatically succeeds on this saving throw if it can't be charmed. On a failed save, a target is affected by this spell. Until the spell ends, you can use a bonus action on each of your turns to designate a direction that is horizontal to you. Each affected target must use as much of its movement as possible to move in that direction on its next turn. It can take its action before it moves After moving in this way, it can make another Wisdom saving to try to end the effect

A target isn't compelled to move into an obviously deadly hazard, such as a fire or pit, but it will provoke opportunity attacks to move in the designated direction.","4","Enchantment","Bard","1 action","30 feet","V, S","Concentration, up to 1 minute"
"1","Cone of Cold","A blast of cold air erupts from your hands. Each creature in a 60-foot cone must make a Constitution saving throw. A creature takes 8d8 cold damage on a failed save, or half as much damage on a successful one.

A creature killed by this spell becomes a frozen statue until it thaws.

At Higher Levels. When you cast this spell using a spell slot of 6th level or higher, the damage increases by 1d8 for each slot level above 5th.","5","Evocation","Sorcerer, Wizard","1 action","Self (60-foot cone)","V, S, M (a small crystal or glass cone)","Instantaneous"
"1","Confusion","This spell assaults and twists creatures' minds, spawning delusions and provoking uncontrolled action. Each creature in a 10-foot-radius sphere centered on a point you choose within range must succeed on a Wisdom saving throw when you cast this spell or be affected by it.

An affected target can't take reactions and must roll a d10 at the start of each of its turns to determine its behavior for that turn.

d10	Behavior
1	The creature uses all its movement to move in a random direction. To determine the direction, roll a d8 and assign a direction to each die face. The creature doesn't take an action this turn.
2–6	The creature doesn't move or take actions this turn.
7–8	The creature uses its action to make a melee attack against a randomly determined creature within its reach. If there is no creature within its reach, the creature does nothing this turn.
9–10	The creature can act and move normally.
At the end of each of its turns, an affected target can make a Wisdom saving throw. If it succeeds, this effect ends for that target.

At Higher Levels. When you cast this spell using a spell slot of 5th level or higher, the radius of the sphere increases by 5 feet for each slot level above 4th.","4","Enchantment","Bard, Druid, Sorcerer, Wizard","1 action","90 feet","V, S, M (three nut shells)","Concentration, up to 1 minute"
"1","Conjure Animals","You summon fey spirits that take the form of beasts and appear in unoccupied spaces that you can see within range. Choose one of the following options for what appears:

One beast of challenge rating 2 or lower
Two beasts of challenge rating 1 or lower
Four beasts of challenge rating 1/2 or lower
Eight beasts of challenge rating 1/4 or lower
Each beast is also considered fey, and it disappears when it drops to 0 hit points or when the spell ends.

The summoned creatures are friendly to you and your companions. Roll initiative for the summoned creatures as a group, which has its own turns. They obey any verbal commands that you issue to them (no action required by you). If you don't issue any commands to them, they defend themselves from hostile creatures, but otherwise take no actions.

The GM has the creatures' statistics.

At Higher Levels. When you cast this spell using certain higher-level spell slots, you choose one of the summoning options above, and more creatures appear: twice as many with a 5th-level slot, three times as many with a 7th-level slot, and four times as many with a 9th-level slot.","3","Conjuration","Druid, Ranger","1 action","60 feet","V, S","Concentration, up to 1 hour"
"1","Conjure Celestial","You summon a celestial of challenge rating 4 or lower, which appears in an unoccupied space that you can see within range. The celestial disappears when it drops to 0 hit points or when the spell ends.
The celestial is friendly to you and your companions for the duration. Roll initiative for the celestial, which has its own turns. It obeys any verbal commands that you issue to it (no action required by you), as long as they don't violate its alignment. If you don't issue any commands to the celestial, it defends itself from hostile creatures but otherwise takes no actions.
The GM has the celestial's statistics.
At Higher Levels. When you cast this spell using a 9th-level spell slot, you summon a celestial of challenge rating 5 or lower.","7","Conjuration","Cleric","1 minute","90 feet","V, S","Concentration, up to 1 hour"
"1","Conjure Elemental","You call forth an elemental servant. Choose an area of air, earth, fire, or water that fills a 10-foot cube within range. An elemental of challenge rating 5 or lower appropriate to the area you chose appears in an unoccupied space within 10 feet of it. For example, a fire elemental emerges from a bonfire, and an earth elemental rises up from the ground.

The elemental disappears when it drops to 0 hit points or when the spell ends. The elemental is friendly to you and your companions for the duration. Roll initiative for the elemental, which has its own turns. It obeys any verbal commands that you issue to it (no action required by you). If you don't issue any commands to the elemental, it defends itself from hostile creatures but otherwise takes no actions.

If your concentration is broken, the elemental doesn't disappear. Instead, you lose control of the elemental, it becomes hostile toward you and your companions, and it might attack. An uncontrolled elemental can't be dismissed by you, and it disappears 1 hour after you summoned it.

The GM has the elemental's statistics.

At Higher Levels. When you cast this spell using a spell slot of 6th level or higher, the challenge rating increases by 1 for each slot level above 5th.","5","Conjuration","Druid, Wizard","1 minute","90 feet","V, S, M (burning incense for air, soft clay for earth, sulfur and phosphorus for fire, or water and sand for water)","Concentration, up to 1 hour"
"1","Conjure Fey","You summon a fey creature of challenge rating 6 or lower, or a fey spirit that takes the form of a beast of challenge rating 6 or lower. It appears in an unoccupied space that you can see within range. The fey creature disappears when it drops to 0 hit points or when the spell ends.

The fey creature is friendly to you and your companions for the duration. Roll initiative for the creature, which has its own turns. It obeys any verbal commands that you issue to it (no action required by you), as long as they don't violate its alignment. If you don't issue any commands to the fey creature, it defends itself from hostile creatures but otherwise takes no actions.

If your concentration is broken, the fey creature doesn't disappear. Instead, you lose control of the fey creature, it becomes hostile toward you and your companions, and it might attack. An uncontrolled fey creature can't be dismissed by you, and it disappears 1 hour after you summoned it.

The GM has the fey creature's statistics.

At Higher Levels. When you cast this spell using a spell slot of 7th level or higher, the challenge rating increases by 1 for each slot level above 6th.","6","Conjuration","Druid Warlock","1 minute","90 ft","V, S","Concentration, up to 1 hour"
"1","Conjure Minor Elementals","Conjure Minor Elementals
4th-level conjuration

Classes: Druid, Wizard

Casting Time: 1 minute

Range: 90 feet

Components: V, S

Duration: Concentration, up to 1 hour

You summon elementals that appear in unoccupied spaces that you can see within range. You choose one the following options for what appears:

One elemental of challenge rating 2 or lower
Two elementals of challenge rating 1 or lower
Four elementals of challenge rating 1/2 or lower
Eight elementals of challenge rating 1/4 or lower.
An elemental summoned by this spell disappears when it drops to 0 hit points or when the spell ends.

The summoned creatures are friendly to you and your companions. Roll initiative for the summoned creatures as a group, which has its own turns. They obey any verbal commands that you issue to them (no action required by you). If you don't issue any commands to them, they defend themselves from hostile creatures, but otherwise take no actions.

The GM has the creatures' statistics.

At Higher Levels. When you cast this spell using certain higher-level spell slots, you choose one of the summoning options above, and more creatures appear: twice as many with a 6th-level slot and three times as many with an 8th-level slot.","4","Conjuration","Druid, Wizard","1 minute","90","V, S","Concentration, up to 1 hour"
"1","Conjure Woodland Beings","Conjure Woodland Beings
4th-level conjuration

Classes: Druid, Ranger

Casting Time: 1 action

Range: 60 feet

Components: V, S, M (one holly berry per creature summoned)

Duration: Concentration, up to 1 hour

You summon fey creatures that appear in unoccupied spaces that you can see within range. Choose one of the following options for what appears:

One fey creature of challenge rating 2 or lower
Two fey creatures of challenge rating 1 or lower
Four fey creatures of challenge rating 1/2 or lower
Eight fey creatures of challenge rating 1/4 or lower
A summoned creature disappears when it drops to 0 hit points or when the spell ends.

The summoned creatures are friendly to you and your companions. Roll initiative for the summoned creatures as a group, which have their own turns. They obey any verbal commands that you issue to them (no action required by you). If you don't issue any commands to them, they defend themselves from hostile creatures, but otherwise take no actions.

The GM has the creatures' statistics.

At Higher Levels. When you cast this spell using certain higher-level spell slots, you choose one of the summoning options above, and more creatures appear: twice as many with a 6th-level slot and three times as many with an 8th-level slot.","4","Conjuration","Druid, Ranger","1 action","60 feet","V, S, M (one holly berry per creature summoned)","Concentration, up to 1 hour"
